{
  "gerado_por": "npm run catalog",
  "nao_edite": "derivado de src/catalog/*.tsx e src/recipes/*.tsx",
  "paginas": [
    {
      "id": "TextoEntrada",
      "titulo": "Texto · entrada",
      "subtitulo": "Como um texto aparece em cena. Trocar a entrada muda o tom do vídeo inteiro — vale escolher antes de escrever qualquer animação.",
      "itens": [
        {
          "nome": "BlurFocusIn",
          "lib": "RemotionUI",
          "importa": "@/remotion/primitives/blur-focus-in",
          "quando": "abertura suave, dá ar de foco de câmera",
          "ciclo": 90
        },
        {
          "nome": "TrackingIn",
          "lib": "RemotionUI",
          "importa": "@/remotion/primitives/tracking-in",
          "quando": "títulos — o espaçamento fecha e assenta",
          "ciclo": 90
        },
        {
          "nome": "StaggeredFadeUp",
          "lib": "RemotionUI",
          "importa": "@/remotion/primitives/staggered-fade-up",
          "quando": "frases — palavra a palavra, ritmo de leitura",
          "ciclo": 110
        },
        {
          "nome": "MaskedSlideReveal",
          "lib": "RemotionUI",
          "importa": "@/remotion/primitives/masked-slide-reveal",
          "quando": "várias linhas com máscara — bem editorial",
          "ciclo": 120
        }
      ]
    },
    {
      "id": "TextoEfeito",
      "titulo": "Texto · efeito",
      "subtitulo": "Texto que carrega personalidade sozinho. Use com parcimônia: um por peça costuma bastar.",
      "itens": [
        {
          "nome": "LightSweepText",
          "lib": "RemotionUI",
          "importa": "@/remotion/primitives/light-sweep-text",
          "quando": "brilho varrendo — o \"gradiente em fundo neutro\"",
          "ciclo": 120
        },
        {
          "nome": "ShimmerSweep",
          "lib": "Remocn",
          "importa": "@/components/remocn/shimmer-sweep",
          "quando": "mesma ideia, API e curva diferentes",
          "ciclo": 120
        },
        {
          "nome": "RgbGlitchText",
          "lib": "RemotionUI",
          "importa": "@/remotion/primitives/rgb-glitch-text",
          "quando": "ruído digital, quebra, energia",
          "ciclo": 100
        },
        {
          "nome": "MatrixDecode",
          "lib": "RemotionUI",
          "importa": "@/remotion/primitives/matrix-decode",
          "quando": "texto se resolvendo a partir de ruído",
          "ciclo": 110
        }
      ]
    },
    {
      "id": "TextoDigitado",
      "titulo": "Texto · digitado e contínuo",
      "subtitulo": "Duas famílias que resolvem problemas opostos: digitação sugere tempo real; marquee preenche espaço sem começo nem fim.",
      "itens": [
        {
          "nome": "Typewriter",
          "lib": "RemotionUI",
          "importa": "@/remotion/primitives/typewriter",
          "quando": "terminal, chat, \"escrevendo agora\"",
          "ciclo": 120
        },
        {
          "nome": "Typewriter",
          "lib": "Remocn",
          "importa": "@/components/remocn/typewriter",
          "quando": "mesma família — controle por chars/segundo",
          "ciclo": 120
        },
        {
          "nome": "SoftBlurIn",
          "lib": "Remocn",
          "importa": "@/components/remocn/soft-blur-in",
          "quando": "entrada mais macia que o BlurFocusIn",
          "ciclo": 90
        },
        {
          "nome": "InfiniteMarquee",
          "lib": "RemotionUI",
          "importa": "@/remotion/primitives/infinite-marquee",
          "quando": "faixa contínua, preenche rodapé ou fundo",
          "ciclo": 150
        }
      ]
    },
    {
      "id": "NumerosDados",
      "titulo": "Números e dados",
      "subtitulo": "Para vídeo de resultado, relatório ou pitch. Número que sobe prende atenção muito mais que número parado.",
      "itens": [
        {
          "nome": "Counter",
          "lib": "RemotionUI",
          "importa": "@/remotion/primitives/counter",
          "quando": "contagem simples de A até B",
          "ciclo": 100
        },
        {
          "nome": "SlotRoll",
          "lib": "RemotionUI",
          "importa": "@/remotion/primitives/slot-roll",
          "quando": "troca de valor com rolagem de cassino",
          "ciclo": 100
        },
        {
          "nome": "ProgressBar",
          "lib": "RemotionUI",
          "importa": "@/remotion/primitives/progress-bar",
          "quando": "meta, carregamento, percentual",
          "ciclo": 110
        },
        {
          "nome": "StatCard",
          "lib": "RemotionUI",
          "importa": "@/remotion/scenes/stat-card",
          "quando": "cena inteira pronta para um número-chave",
          "ciclo": 120,
          "cena": true
        }
      ]
    },
    {
      "id": "FundosAmbiente",
      "titulo": "Fundos e ambiente",
      "subtitulo": "Camada de baixo. Resolve o \"fundo neutro mas não morto\" sem você desenhar nada — combine com um texto por cima.",
      "itens": [
        {
          "nome": "MeshGradientBg",
          "lib": "RemotionUI",
          "importa": "@/remotion/primitives/mesh-gradient-bg",
          "quando": "gradiente vivo, respira devagar",
          "ciclo": 150
        },
        {
          "nome": "DynamicGrid",
          "lib": "RemotionUI",
          "importa": "@/remotion/primitives/dynamic-grid",
          "quando": "malha de pontos — ar técnico, discreto",
          "ciclo": 150
        },
        {
          "nome": "MatrixRain",
          "lib": "Bits",
          "importa": "remotion-bits",
          "quando": "chuva de caracteres — fundo com movimento forte",
          "ciclo": 150
        },
        {
          "nome": "ConfettiBurst",
          "lib": "RemotionUI",
          "importa": "@/remotion/primitives/confetti-burst",
          "quando": "celebração, fim de vídeo, conquista",
          "ciclo": 65
        }
      ]
    },
    {
      "id": "CenasProntas",
      "titulo": "Cenas prontas",
      "subtitulo": "Blocos maiores, já compostos. Servem de esqueleto: instale, troque o texto e as cores, e você tem uma seção resolvida.",
      "itens": [
        {
          "nome": "LowerThird",
          "lib": "RemotionUI",
          "importa": "@/remotion/scenes/lower-third",
          "quando": "identificar quem fala, canto inferior",
          "ciclo": 120,
          "cena": true
        },
        {
          "nome": "MetricTicker",
          "lib": "RemotionUI",
          "importa": "@/remotion/scenes/metric-ticker",
          "quando": "três ou quatro números em sequência",
          "ciclo": 150,
          "cena": true
        },
        {
          "nome": "Confetti",
          "lib": "Remocn",
          "importa": "@/components/remocn/confetti",
          "quando": "partículas com física — gravidade e potência",
          "ciclo": 70
        },
        {
          "nome": "MatrixRain + texto",
          "lib": "Bits",
          "importa": "remotion-bits",
          "quando": "exemplo de camadas: fundo + texto por cima",
          "ciclo": 130
        }
      ]
    },
    {
      "id": "GraficosDados",
      "titulo": "Gráficos e dados",
      "subtitulo": "Quando o vídeo precisa provar algo. Gráfico que se desenha na frente do espectador convence mais que gráfico pronto.",
      "itens": [
        {
          "nome": "AnimatedBarChart",
          "lib": "RemotionUI",
          "importa": "@/remotion/scenes/animated-bar-chart",
          "quando": "comparar categorias — barras crescem em stagger",
          "ciclo": 130,
          "cena": true
        },
        {
          "nome": "LineChartDraw",
          "lib": "RemotionUI",
          "importa": "@/remotion/primitives/line-chart-draw",
          "quando": "evolução no tempo — a linha se desenha",
          "ciclo": 120
        },
        {
          "nome": "TimelineSteps",
          "lib": "RemotionUI",
          "importa": "@/remotion/scenes/timeline-steps",
          "quando": "processo em etapas — fluxo, roadmap, método",
          "ciclo": 150,
          "cena": true
        },
        {
          "nome": "CalloutSpotlight",
          "lib": "RemotionUI",
          "importa": "@/remotion/scenes/callout-spotlight",
          "quando": "apontar um detalhe na tela — escurece o resto",
          "ciclo": 130,
          "cena": true
        }
      ]
    },
    {
      "id": "CodigoTerminal",
      "titulo": "Código e terminal",
      "subtitulo": "Para vídeo técnico, changelog e tutorial. Mostrar o comando rodando vale mais que descrever o comando.",
      "itens": [
        {
          "nome": "CodeReveal",
          "lib": "RemotionUI",
          "importa": "@/remotion/scenes/code-reveal",
          "quando": "trecho de código com linhas destacadas",
          "ciclo": 150,
          "cena": true
        },
        {
          "nome": "TerminalSimulator",
          "lib": "RemotionUI",
          "importa": "@/remotion/scenes/terminal-simulator",
          "quando": "simular instalação, build, deploy",
          "ciclo": 160,
          "cena": true
        },
        {
          "nome": "DeviceMockupZoom",
          "lib": "RemotionUI",
          "importa": "@/remotion/scenes/device-mockup-zoom",
          "quando": "produto em moldura de browser, phone ou laptop",
          "ciclo": 150,
          "cena": true
        },
        {
          "nome": "SimulatedCursor",
          "lib": "RemotionUI",
          "importa": "@/remotion/primitives/simulated-cursor",
          "quando": "demonstrar um clique — cursor falso com trajeto",
          "ciclo": 120,
          "cena": true
        }
      ]
    },
    {
      "id": "MidiaEnquadramento",
      "titulo": "Mídia e enquadramento",
      "subtitulo": "O que fazer com uma imagem ou vídeo que você já tem. Movimento de câmera falso salva material estático.",
      "itens": [
        {
          "nome": "MediaFrame",
          "lib": "RemotionUI",
          "importa": "@/remotion/scenes/media-frame",
          "quando": "vídeo ou imagem com moldura, título e legenda",